"Connection", "Skill"
445, "Security, Information Security, Penetration Testing, Information Security..., Firewalls, CEH, CISSP, Software Development, Cloud Computing, CISA, Network Security, ITIL, Vulnerability Assessment."
446, "IT Audit, CISA, Information Security..., Governance, Business Continuity, COBIT, CISM, Disaster Recovery, Information Security, ISO 27001."
447, "Financial Modeling, IT Audit, Predictive Modeling, Internal Audit, Statistical Modeling, SOX Compliancy, Operations Research, Genetic Algorithms, Business Statistics, Time Series Analysis, Risk Management, Regression Analysis, Data Modeling, Bayesian statistics, Stochastic Modeling, Data Mining, R, Reverse Logistics, Business Process..., JMT, JMP, SAS, SPSS, MRP, MRPII, VAR."
448, "Personal Development, Management Development, Coaching, Executive Coaching, Executive Development, Culture Change, Change Management, Program Facilitation, Leadership Development, NLP."
449, " "
450, " "
451, "CRM, Solution Selling, Entrepreneurship, Cloud Computing, Business Strategy, Business Intelligence, SaaS, Outsourcing, Management Consulting."
452, "ITIL, Data Center, Integration, IT Strategy, Management."
453, " "
454, "Integrated Marketing, Marketing Management, Marketing Communications, Product Management, Marketing, Strategic Planning, Strategic Thinking, Brand Management, Segmentation, Business Development."
455, "Cloud Computing, Go-to-market Strategy, SaaS, Enterprise Software, Solution Selling, Product Management, Business Development, BIM."
456, "Mobile Applications, Mobile Marketing, Android, Mobile Devices, iOS development, iPhone, Business Development."
457, "Databases, Java, Unix, Oracle, Integration, Linux, Software Project..., Requirements Analysis, Data Migration."
458, "Recruiting, Start-ups, Vendor Management."
459, "Accounting, Business Strategy, Governance, Executive Management, Change Management, Management Consulting, Team Building, Project Planning, Regulatory Requirements."
460, "Brand Management, Marketing, Marketing Communications, Marketing Strategy, Marketing Research, Social Media Marketing."
461, "SEO, Online Marketing."
462, "Data Center, Telecommunications, Cloud Computing, Strategic Partnerships, IP, Channel Partners, Management, New Business Development, Vendor Management."
463, "IT Strategy, Asia Pacific, IT Management, Strategic Planning, Leadership, Strategic Partnerships, Information Technology, Vendor Management."
464, "Cloud Computing, Enterprise Software, Professional Services."
465, "New Media, Online Advertising, Social Media, Digital Media, Social Media Marketing, E-commerce."
466, "Enterprise Software, Cloud Computing, SaaS, Software Development, IT Strategy, Professional Services, SOA, Enterprise Architecture, Project Management."
467, "Breaking News, Journalism, Newspapers, Online Journalism, Publications, News Writing, Project Management, Advertorials, Online News, Account Servicing, Content Strategy, Copywriting, Editorial."
468, "Cloud Computing, SharePoint, C#, .NET, Akamai, Streaming Media, Project Server, PMP, EPM, C."
469, "Human Resources, Employee Relations, HR Policies, Performance Management, Talent Management, Recruiting, Employee Engagement, HRIS, HR Consulting, Talent Acquisition, Personnel Management, Succession Planning."
470, "Settlement, Investment Banking, Equities, Unix Shell Scripting, SWIFT messaging, Unix, Solaris, SQL Tuning, Securities, Euroclear, Oracle SQL, SQL*Plus, Microsoft SQL Server, Perl, Windows, Java, Swift Alliance, Omgeo Oasys, PayPlus, Continuous Linked..., HP-UX."
471, "Business Development, Payments, Strategy, Mobile Payments, E-commerce, Strategic Partnerships, Leadership."
472, "Security, Cloud Computing, Business Development, Start-ups."
473, "Digital Media, Digital Marketing, Online Advertising, Mobile Devices, Digital Strategy, Mobile Marketing, Strategy."
474, "Business Intelligence, Telecommunications, Solution Selling, Outsourcing, Software Development, Business Development, Business Analysis."
475, " "
476, "Information Architecture, Usability Testing, User-centered Design, User Experience, Heuristic Evaluation, Interaction Design, Human Computer..., Persona, Card Sorting, User Interface Design, Contextual Inquiry, User Research, User Experience Design."
477, "Account Management, Marketing Communications, Business English, Mandarin, Cantonese, French."
478, "CISA, Internal Controls, Accounting, Governance, Sarbanes-Oxley Act, Big 4, IT Strategy, Information Security..., Information Security, Internal Audit, Business Continuity, Security, ITIL, IT Risk Management, PCI DSS, CISSP, Cloud Computing, Network Security, Computer Security, Vendor Management, IT Management."
479, "Domain Names, Internet Services, Event Management, IPv6, Project Management, Service Providers, Internet Strategy, Business Development, Start-ups."
480, " "
481, " "
482, "Business Development, CRM, Business Strategy, Leadership."
483, "Android, MySQL, iOS development, Web Applications, Objective-C, Mobile Devices."
484, "Tax, International Tax, Private Equity, Transfer Pricing, Financial Services, Tax Advisory, Human Resources, Hedge Funds, Management Consulting, Corporate Tax, Start-ups."
485, "Public Relations, Event Management, Project Management, Strategy, Social Media Marketing, Marketing."
486, " "
487, "Business Development, Web Video, VOD, Business Intelligence, IPTV."
488, "Governance, Information Security..., IT Audit, Security, Disaster Recovery."
489, "Program Management, Enterprise Architecture, Business Alliances, Solution Architecture, Professional Services."
490, "Post Production, Media Production, Digital Media, Social Media, Production Managment, Television, Animation, Producing, Project Coordination."
491, " "
492, "Recruiting, Sourcing, Talent Management, Human Resources, Start-ups."
493, "Internal Audit, Access, Risk Management, Auditing, Visio, Project Management, Internal Controls, IT Audit."
494, " "
495, "E-commerce, Cloud Computing, Enterprise Software, Software Project..., Solution Selling, HTML, Account Management, Product Management, Business Intelligence."
496, "Cloud Computing, SaaS, New Business Development."
497, "Project Management, Cloud Computing, Leadership, Business Strategy, IT Strategy, Start-ups, SaaS, Management Consulting."
498, "ERP, SAP ERP, SAP, SAP Netweaver, Business Intelligence, Enterprise Software, ABAP."
499, "Risk Management, Due Diligence, Management Consulting, Corporate Governance, Internal Audit, Enterprise Risk..., Auditing, Change Management."
500, "Cloud Computing, Strategy, SaaS, Business Development, Enterprise Software, Start-ups."
501, "Leadership, Marketing Strategy, Solution Selling, SaaS, Business Intelligence."
502, "Sports Marketing, Sports, Product Management."
503, "Management, Business Development, Business Strategy, Leadership, Project Management, Business Analysis, Team Building, New Business Development, Management Consulting."
504, "Cloud Computing, Product Management, E-commerce, B2B, CRM, SaaS."
505, "Management, Cloud Computing, Enterprise Software, Solution Selling, SaaS, Business Intelligence, Channel, Sales & Marketing...."
506, "Enterprise Software, Go-to-market Strategy, Cloud Computing, Strategy."
507, "Cloud Computing, Business Intelligence, Digital Media, Social Media, Digital Marketing, Facebook, Business, Security."
508, "IT Strategy, IT Outsourcing, IT Service Management, Managed Services, IT Operations, Vendor Management."
509, "Advertising, Digital Marketing, Mobile Marketing, Online Advertising, Marketing Strategy, Marketing Communications, Online Marketing, E-commerce."
510, "SEM, Digital Marketing, Web Analytics, Analytics, Mobile Devices, Social Media, Digital Strategy."
511, "Digital Marketing, Business Development, Mobile Marketing, Online Advertising, Digital Media, Media Sales, Mobile Advertising, Digital Strategy, SEM, Search Marketing, E-commerce, Online Marketing, Ad Networks, Analytics, Media Planning, Account Management, Social Media Marketing, Strategic Partnerships."
512, "Cloud Computing, Go-to-market Strategy, Business Development, Leadership, Product Marketing, ERP, Sales Management, Solution Selling, Business Operations."
513, " "
514, "Start-ups, Strategic Partnerships, Strategy, Professional Services, Program Management, Management, Entrepreneurship, Strategic Planning."
515, "Solution Selling, Professional Services, Selling, SaaS, Account Management, Leadership, Strategy, Sales Management."
516, "Information Security, Security, Penetration Testing, Computer Forensics, CISSP, IT Management."
517, "Teaching, Social Networking, Training, Staff Development, Leadership, Career Counseling, Project Management, University Teaching."
518, "E-commerce, Cloud Computing, Vendor Management, Agile Project Management, Software Development, Web Project Management, Strategic Planning, Digital Marketing."
519, "Banking, User Experience, Strategy, Digital Strategy, IT Management, Project Management, Change Management, Integration, CISA, Information Security, CRM, Credit Risk, Commercial Banking, Retail Banking."
520, "E-commerce, Software Development, Management, Digital Media, Software Project..., Team Management."
521, "ERP, IT Strategy, Management Consulting, Business Process..., Business Analysis, PMP, Project Management, Enterprise Architecture, Smart Grid, Technology Enabled..., Operations Management, Change Management, Stakeholder Management."
522, "Documentaries, Video Production, Broadcast."
523, "Project Management, SDLC, Security, PMP, Process Improvement, Management, Integration, Testing, Quality Assurance, Analysis, Project Planning, Software Project..., Vendor Management, Business Analysis, Risk Management."
524, "Web Development, PHP, jQuery, MySQL, Flash, Programming, JavaScript, CSS, HTML, SQL, Social Media, HTML 5, Linux."
525, "Key Account Management, Demand Generation, Value Based Selling, CXO level engagement, Goal-oriented...."
526, "Cloud Computing, Solution Selling, Project Management, Channel Partners, International Sales, Product Management, Start-ups, Business Strategy, Channel, SaaS, Strategy, Data Center, Team Leadership, Strategic Partnerships, Security, Product Marketing, Marketing Strategy."
527, "ITIL, IT Management, Data Center, Operations Management, Information Technology, IT Strategy, Change Management."
528, "Security, Network Security, Cloud Computing, Information Security, CISSP, Telecommunications."
529, "Business Development, Strategy, Market Research, Management, Mobile Devices, Financial Analysis, Competitive Analysis."
530, "IT Management, IT Strategy, Integration, SaaS, Program Management, Business Analysis, Consulting."
531, "Information Security, Information Security..., CISSP, ISO 27001, PCI DSS."
532, "Telecommunications, PMP, Semiconductors, CCNA, Electronics, Cisco, Engineering."
533, "Project Management."
534, "Negotiation, Product Management, Contract Negotiation."
